Act of Kindness Ideas,Photo_ID,Photo_Name,Link to Site for Action
Bake cookies for a neighbor,0,IMG_5265.jpeg,https://www.allrecipes.com/gallery/best-cookie-recipes-of-all-time/
Text a friend you haven't spoken to in a while to see how they're doing,1,IMG_3568.jpeg,https://www.joincake.com/blog/just-checking-in/
Sign up for a volunteer shift in your community,2,IMG_3859.jpeg,https://www.volunteermatch.org/
Text a friend to schedule a walk together,3,IMG_3828.jpeg,https://www.traillink.com/activity/walking-trails/
Find a flower,4,IMG_5275.jpeg,https://localflowers.org/find-flowers/
Go on a walk and smile at someone you pass by,5,IMG_2841.jpeg,https://www.traillink.com/activity/walking-trails/
Find a nearby Little Free Library or Start One in your neighborhood,6,IMG_5377.jpeg,https://littlefreelibrary.org/start/
Research your nearby Farmer's Market and go to the next one,7,IMG_2710.jpeg,https://www.farmersmarketplaces.com/